<?xml version="1.0" encoding="UTF-8"?>
<xs:schema xmlns:xs="http://www.w3.org/2001/XMLSchema" elementFormDefault="qualified">
  <xs:element name="alumnos">
    <xs:complexType>
      <xs:sequence>
        <xs:element ref="alumno" maxOccurs="unbounded"/>
      </xs:sequence>
    </xs:complexType>
  </xs:element>
  <xs:element name="alumno">
    <xs:complexType>
      <xs:sequence>
        <xs:element name="nombre" type="xs:string"/>
        <xs:element name="apellidos" type="xs:string"/>
        <xs:element name="edad" type="xs:string" minOccurs="0"/>
        <xs:element name="nota">
          <xs:simpleType>
            <xs:union memberTypes="decilaldos nopresentado"/>
          </xs:simpleType>
        </xs:element>
        <xs:element name="comentario" type="xs:string" minOccurs="0"/>
        <xs:element ref="direccion" minOccurs="0"/>
      </xs:sequence>
      <xs:attribute name="dni" type="xs:string" use="required"/>
    </xs:complexType>
  </xs:element>
  <xs:element name="direccion">
    <xs:complexType>
      <xs:sequence>
        <xs:element name="calle" type="xs:string"/>
        <xs:element name="numero" type="xs:string"/>
        <xs:element name="ciudad" type="xs:string"/>
        <xs:element name="provincia" type="xs:string"/>
      </xs:sequence>
    </xs:complexType>
  </xs:element>
  <xs:simpleType name="decilaldos">
    <xs:restriction base="xs:decimal">
      <xs:fractionDigits value="2"/>
    </xs:restriction>
  </xs:simpleType>
  <xs:simpleType name="nopresentado">
    <xs:restriction base="xs:string">
      <xs:pattern value="No presentado"/>
    </xs:restriction>
  </xs:simpleType>
</xs:schema>
